[
  {
    "id": "iq-format-cs8",
    "name": "Complex Signed 8-bit interleaved (.cs8)",
    "aliases": [".cs8", "signed int8 IQ"],
    "category": "iq_format",
    "region": "universal",
    "era_bounds": ["2010-01-01", null],
    "still_effective_2026": true,
    "confidence": "primary",
    "citations": ["hackrf-docs", "sigmf-spec"],
    "technical_body": {
      "sample_type": "int8",
      "signed": true,
      "bits_per_sample": 8,
      "interleaving": "I0 Q0 I1 Q1 ...",
      "endianness": "little-endian (byte-order irrelevant at 8 bits)",
      "value_range": [-128, 127],
      "scale_to_complex64": "raw.astype(float32) / 128 -> complex",
      "canonical_source": "HackRF hackrf_transfer",
      "sigmf_datatype": "ci8"
    },
    "hackrf_role": "primary-native-format",
    "tools_upstream": ["hackrf_transfer", "hackrf-agent capture_iq"],
    "tools_downstream": ["numpy", "gnuradio", "urh", "inspectrum", "sigmf tools"],
    "see_also": ["iq-format-cu8", "iq-format-cs16", "iq-format-cf32"]
  },
  {
    "id": "iq-format-cu8",
    "name": "Complex Unsigned 8-bit interleaved (.cu8)",
    "aliases": [".cu8", "unsigned int8 IQ"],
    "category": "iq_format",
    "region": "universal",
    "era_bounds": ["2012-01-01", null],
    "still_effective_2026": true,
    "confidence": "primary",
    "citations": ["rtl-433-github", "sigmf-spec"],
    "technical_body": {
      "sample_type": "uint8",
      "signed": false,
      "bits_per_sample": 8,
      "interleaving": "I0 Q0 I1 Q1 ...",
      "value_range": [0, 255],
      "bias": "~127.5 (offset-binary)",
      "scale_to_complex64": "(raw.astype(float32) - 127.5) / 127.5 -> complex",
      "canonical_source": "RTL-SDR rtl_sdr",
      "sigmf_datatype": "cu8"
    },
    "hackrf_role": "not-native-but-common",
    "tools_downstream": ["rtl_433", "gqrx", "sdrangel", "numpy"],
    "disputed": {"field": "bias", "note": "Some tools use 127, others 127.5; the visual difference is a tiny DC spike either way."},
    "see_also": ["iq-format-cs8"]
  },
  {
    "id": "iq-format-cs16",
    "name": "Complex Signed 16-bit interleaved (.cs16)",
    "aliases": [".cs16", "ci16"],
    "category": "iq_format",
    "region": "universal",
    "era_bounds": ["2005-01-01", null],
    "still_effective_2026": true,
    "confidence": "primary",
    "citations": ["sigmf-spec"],
    "technical_body": {
      "sample_type": "int16",
      "signed": true,
      "bits_per_sample": 16,
      "interleaving": "I0 Q0 I1 Q1 ...",
      "endianness": "little-endian (SigMF ci16_le); big-endian variant exists (ci16_be)",
      "value_range": [-32768, 32767],
      "scale_to_complex64": "raw.astype(float32) / 32768 -> complex",
      "canonical_source": "LimeSDR, USRP export, HackRF via post-processing",
      "sigmf_datatype": "ci16_le"
    },
    "hackrf_role": "post-processing-format",
    "see_also": ["iq-format-cs8", "iq-format-cf32"]
  },
  {
    "id": "iq-format-cf32",
    "name": "Complex Float32 interleaved (.cf32)",
    "aliases": [".cf32", "cf32", "GNU Radio native"],
    "category": "iq_format",
    "region": "universal",
    "era_bounds": ["2005-01-01", null],
    "still_effective_2026": true,
    "confidence": "primary",
    "citations": ["gnu-radio-wiki", "sigmf-spec"],
    "technical_body": {
      "sample_type": "float32",
      "bits_per_sample": 32,
      "interleaving": "I0 Q0 I1 Q1 ...",
      "endianness": "little-endian (cf32_le); big-endian rare",
      "value_range": "conventionally [-1.0, +1.0] but not enforced",
      "scale_to_complex64": "np.fromfile(path, dtype=np.complex64)",
      "canonical_source": "GNU Radio",
      "sigmf_datatype": "cf32_le"
    },
    "hackrf_role": "post-processing-format",
    "tools_upstream": ["gnuradio", "numpy"],
    "tools_downstream": ["gnuradio", "urh", "inspectrum", "numpy", "sdrangel"],
    "see_also": ["iq-format-cs16", "iq-format-cf64"]
  },
  {
    "id": "iq-format-cf64",
    "name": "Complex Float64 interleaved (.cf64)",
    "aliases": [".cf64"],
    "category": "iq_format",
    "region": "universal",
    "era_bounds": ["2005-01-01", null],
    "still_effective_2026": true,
    "confidence": "community",
    "citations": ["sigmf-spec"],
    "technical_body": {
      "sample_type": "float64",
      "bits_per_sample": 64,
      "interleaving": "I0 Q0 I1 Q1 ...",
      "sigmf_datatype": "cf64_le",
      "notes": "Rare in the wild; used for scientific dumps where precision matters more than file size."
    },
    "hackrf_role": "scientific-only",
    "see_also": ["iq-format-cf32"]
  },
  {
    "id": "iq-format-wav-float",
    "name": "WAV container with float32 IQ (.wav)",
    "aliases": ["SDR# WAV", "HDSDR WAV"],
    "category": "iq_format",
    "region": "universal",
    "era_bounds": ["2010-01-01", null],
    "still_effective_2026": true,
    "confidence": "community",
    "citations": ["sigmf-spec"],
    "technical_body": {
      "sample_type": "float32",
      "container": "RIFF/WAVE",
      "channels": 2,
      "channel_convention": "channel 0 = I, channel 1 = Q",
      "header_bytes": 44,
      "notes": "WAV sample-rate field caps at 4.29 GHz theoretically, but many players choke above 384 kHz."
    },
    "hackrf_role": "interoperability-format",
    "tools_downstream": ["sdr#", "hdsdr"],
    "see_also": ["iq-format-wav-int16"]
  },
  {
    "id": "iq-format-wav-int16",
    "name": "WAV container with int16 IQ (.wav)",
    "category": "iq_format",
    "region": "universal",
    "era_bounds": ["2010-01-01", null],
    "still_effective_2026": true,
    "confidence": "community",
    "citations": ["sigmf-spec"],
    "technical_body": {
      "sample_type": "int16",
      "container": "RIFF/WAVE",
      "channels": 2,
      "channel_convention": "channel 0 = I, channel 1 = Q",
      "notes": "Lower dynamic range than the float32 WAV variant; some SDR programs export this by default."
    },
    "hackrf_role": "interoperability-format",
    "see_also": ["iq-format-wav-float"]
  },
  {
    "id": "iq-format-sigmf",
    "name": "SigMF paired file (.sigmf-data + .sigmf-meta)",
    "aliases": ["SigMF"],
    "category": "iq_format",
    "region": "universal",
    "era_bounds": ["2018-01-01", null],
    "still_effective_2026": true,
    "confidence": "primary",
    "citations": ["sigmf-spec"],
    "technical_body": {
      "structure": "data file (any SigMF datatype) + JSON metadata sidecar",
      "datatype_field": "core:datatype in .sigmf-meta (e.g. cf32_le, ci16_le, cu8)",
      "sample_rate_field": "core:sample_rate",
      "annotation_support": true,
      "captures_support": "multiple capture segments in one data file",
      "notes": "Emerging community standard. Prefer for archival captures; the sidecar carries center frequency, timestamps, gains, and per-segment annotations that a bare .cs8 loses."
    },
    "hackrf_role": "archival-format",
    "tools_upstream": ["sigmf-python", "gnuradio SigMF blocks"],
    "tools_downstream": ["sigmf-python", "gnuradio"],
    "see_also": ["iq-format-cs8", "iq-format-cf32"]
  }
]
