[
  {
    "id": "decoder-manchester",
    "name": "Manchester (IEEE 802.3 / G.E. Thomas)",
    "aliases": ["biphase-L", "biphase level", "Manchester encoding"],
    "category": "decoder_family",
    "region": "universal",
    "era_bounds": ["1949-01-01", null],
    "still_effective_2026": true,
    "confidence": "primary",
    "citations": ["proakis-digital-comm", "hackrf-agent-repo"],
    "technical_body": {
      "encoding_rule": "Each bit is transmitted as two half-symbols; a transition mid-bit encodes the value.",
      "conventions": {
        "ieee_802_3": "0 = low→high transition, 1 = high→low transition",
        "g_e_thomas": "0 = high→low transition, 1 = low→high transition (inverse)"
      },
      "self_clocking": true,
      "dc_balance": "zero-DC (equal high and low time per bit)",
      "preamble_typical": "0xAA/0x55 alternating (mid-bit transitions produce a clean clock spike)",
      "symbol_rate_range_bps": [100, 1000000],
      "canonical_use_cases": [
        "OOK keyfobs at 315/433 MHz (rolling code + fixed code)",
        "TPMS (Schrader, Continental)",
        "10BASE-T Ethernet PHY",
        "some weather stations (Acurite 592TXR, Fine Offset WH1080)"
      ],
      "polarity_recovery": "Try both polarity assumptions; the one that yields a valid preamble/CRC wins."
    },
    "hackrf_role": "analyze",
    "blocked_tx": false,
    "tools_upstream": ["analyze_iq_symbols"],
    "tools_downstream": ["hackrf-agent decode_manchester", "urh"],
    "see_also": ["decoder-diff-manchester", "decoder-nrz", "protocol-tpms-schrader", "modulation-ook"]
  },
  {
    "id": "decoder-diff-manchester",
    "name": "Differential Manchester",
    "aliases": ["biphase-M", "biphase mark/space", "conditional biphase"],
    "category": "decoder_family",
    "region": "universal",
    "era_bounds": ["1960-01-01", null],
    "still_effective_2026": true,
    "confidence": "primary",
    "citations": ["proakis-digital-comm"],
    "technical_body": {
      "encoding_rule": "Mid-bit transition always present (for clock recovery). A start-of-bit transition encodes the value.",
      "conventions": {
        "biphase_mark": "0 = start-of-bit transition, 1 = no start-of-bit transition",
        "biphase_space": "0 = no start-of-bit transition, 1 = start-of-bit transition"
      },
      "self_clocking": true,
      "dc_balance": "zero-DC",
      "canonical_use_cases": [
        "token ring 802.5",
        "some ISO/IEC 14443 (RFID) uplinks",
        "occasional keyfob variants that resist plain Manchester decoders"
      ],
      "polarity_recovery": "polarity independent — this is the main advantage over plain Manchester."
    },
    "hackrf_role": "analyze",
    "blocked_tx": false,
    "tools_downstream": ["hackrf-agent decode_manchester"],
    "see_also": ["decoder-manchester"]
  },
  {
    "id": "decoder-nrz",
    "name": "NRZ (non-return-to-zero)",
    "aliases": ["NRZ-L", "unipolar NRZ", "polar NRZ"],
    "category": "decoder_family",
    "region": "universal",
    "era_bounds": ["1950-01-01", null],
    "still_effective_2026": true,
    "confidence": "primary",
    "citations": ["proakis-digital-comm", "hackrf-agent-repo"],
    "technical_body": {
      "encoding_rule": "Level directly encodes the bit for the full symbol period; no mid-bit transition.",
      "self_clocking": false,
      "dc_balance": "not DC-balanced; long runs of 0s or 1s produce DC bias",
      "clock_recovery": "requires a preamble (e.g. 0xAA) or an external clock reference; matched-filter timing recovery on a training sequence.",
      "canonical_use_cases": [
        "POCSAG (after 2FSK demod → NRZ bits)",
        "many FSK-based paging/telemetry protocols",
        "raw-bit output of most demodulators"
      ],
      "symbol_rate_range_bps": [50, 10000000]
    },
    "hackrf_role": "analyze",
    "blocked_tx": false,
    "tools_upstream": ["analyze_iq_symbols"],
    "tools_downstream": ["hackrf-agent decode_nrz", "multimon-ng"],
    "see_also": ["decoder-nrzi", "decoder-manchester", "protocol-pocsag-1200"]
  },
  {
    "id": "decoder-nrzi",
    "name": "NRZI (non-return-to-zero inverted)",
    "aliases": ["NRZ-I", "NRZ-mark", "NRZ-space"],
    "category": "decoder_family",
    "region": "universal",
    "era_bounds": ["1950-01-01", null],
    "still_effective_2026": true,
    "confidence": "primary",
    "citations": ["proakis-digital-comm"],
    "technical_body": {
      "encoding_rule": "A transition at the start of a symbol encodes one binary value; no transition encodes the other. Value = XOR of previous level.",
      "conventions": {
        "nrz_mark": "1 = transition, 0 = no transition",
        "nrz_space": "0 = transition, 1 = no transition"
      },
      "self_clocking": "partial — a long run of 0s (NRZ-mark) has no transitions; requires bit-stuffing (as HDLC does) or preamble.",
      "canonical_use_cases": [
        "HDLC / AX.25 packet radio (Bell 202 AFSK-1200, FSK-9600)",
        "USB PHY (with bit-stuffing after 6 consecutive 1s)",
        "some ISO/IEC 14443 (RFID) downlinks"
      ],
      "bit_stuffing_note": "HDLC/AX.25 insert a 0 after 5 consecutive 1s to avoid loss of clock; the decoder must strip it before payload assembly."
    },
    "hackrf_role": "analyze",
    "blocked_tx": false,
    "tools_upstream": ["analyze_iq_symbols"],
    "tools_downstream": ["hackrf-agent decode_nrz", "hackrf-agent decode_ax25"],
    "see_also": ["decoder-nrz", "protocol-ax25"]
  },
  {
    "id": "decoder-pwm",
    "name": "PWM (pulse-width modulation)",
    "aliases": ["pulse-width encoding", "duty-cycle encoding"],
    "category": "decoder_family",
    "region": "universal",
    "era_bounds": ["1970-01-01", null],
    "still_effective_2026": true,
    "confidence": "primary",
    "citations": ["rtl-433-github", "hackrf-agent-repo"],
    "technical_body": {
      "encoding_rule": "Each bit is a fixed-period pulse; the ratio of high time to low time within the period encodes the bit.",
      "conventions": {
        "short_high_long_low": "0 = short high + long low, 1 = long high + short low",
        "vendor_variants": "polarity and short/long roles are vendor-specific — invert if the preamble misses."
      },
      "self_clocking": true,
      "typical_short_us": [200, 800],
      "typical_long_us": [600, 2400],
      "canonical_use_cases": [
        "Chamberlain/LiftMaster garage-door fixed codes",
        "some HomeEasy/Nexa 433 MHz remotes",
        "IR remotes (NEC, RC-5, Sony SIRC — same principle over IR carrier)",
        "many 433 MHz weather-station formats"
      ]
    },
    "hackrf_role": "analyze",
    "blocked_tx": false,
    "tools_upstream": ["analyze_iq_symbols"],
    "tools_downstream": ["hackrf-agent decode_pwm", "rtl_433", "urh"],
    "see_also": ["decoder-ppm", "decoder-manchester", "protocol-garage-door-genie"]
  },
  {
    "id": "decoder-ppm",
    "name": "PPM (pulse-position modulation)",
    "aliases": ["pulse-position encoding", "pulse-interval encoding"],
    "category": "decoder_family",
    "region": "universal",
    "era_bounds": ["1970-01-01", null],
    "still_effective_2026": true,
    "confidence": "primary",
    "citations": ["rtl-433-github", "hackrf-agent-repo"],
    "technical_body": {
      "encoding_rule": "A short pulse of fixed width; the *gap* between successive pulses encodes the bit value.",
      "conventions": {
        "short_gap_long_gap": "0 = short gap, 1 = long gap (or the inverse; polarity is vendor-specific)"
      },
      "self_clocking": true,
      "typical_pulse_us": [50, 500],
      "typical_short_gap_us": [200, 1000],
      "typical_long_gap_us": [500, 2500],
      "canonical_use_cases": [
        "Acurite temperature/humidity 433 MHz",
        "Oregon Scientific weather V2 protocol",
        "some IR remotes",
        "ADS-B (Mode S) uses PPM at the bit level: 1 μs slot, first-half high = 1, second-half high = 0"
      ]
    },
    "hackrf_role": "analyze",
    "blocked_tx": false,
    "tools_upstream": ["analyze_iq_symbols"],
    "tools_downstream": ["hackrf-agent decode_ppm", "hackrf-agent decode_ads_b", "rtl_433"],
    "see_also": ["decoder-pwm", "protocol-mode-s-1090"]
  },
  {
    "id": "decoder-pcm",
    "name": "PCM (pulse-code modulation)",
    "aliases": ["straight bit sampling"],
    "category": "decoder_family",
    "region": "universal",
    "era_bounds": ["1937-01-01", null],
    "still_effective_2026": true,
    "confidence": "primary",
    "citations": ["proakis-digital-comm"],
    "technical_body": {
      "encoding_rule": "Sample the analog channel at Nyquist rate; represent each sample as an N-bit code word. Not a line code — a *source* code. Here for cross-reference only.",
      "canonical_use_cases": [
        "μ-law/A-law telephony (G.711)",
        "CD audio (16-bit linear PCM at 44.1 kHz)",
        "many digital voice trunks (DMR, TETRA, P25 use vocoders that then feed PCM into a channel code)"
      ],
      "note": "In an RF context, treat PCM as the *content* riding on top of an actual channel code (NRZ, Manchester, …). A decoder rarely sees raw PCM off the air."
    },
    "hackrf_role": "analyze",
    "blocked_tx": false,
    "tools_downstream": [],
    "see_also": ["decoder-nrz"]
  }
]
